Name,Text,Pre2022,Length
1984 by George Orwell,"It was always very much the same. He was standing in front of a wall of darkness, and on the other side of it there was something unendurable, something too dreadful to be faced. In the dream his deepest feeling was always one of self-deception, because he did in fact know what was behind the wall of darkness. With a deadly effort, like wrenching a piece out of his own brain, he could even have dragged the thing into the open. He always woke up without discovering what it was: but somehow it was connected with what Julia had been saying when he cut her short. 'I'm sorry,' he said, 'it's nothing. I don't like rats, that's all.' 'Don't worry, dear, we're not going to have the filthy brutes in here. I'll stuff the hole with a bit of sacking before we go. And next time we come here I'll bring some plaster and bung it up properly.' Already the black instant of panic was half-forgotten. Feeling slightly ashamed of himself, he sat up against the bedhead. Julia got out of bed, pulled on her overalls, and made the coffee. The smell that rose from the saucepan was so powerful and exciting that they shut the window lest anybody outside should notice it and become inquisitive. What was even better than the taste of the coffee was the silky texture given to it by the sugar, a thing Winston had almost forgotten after years of saccharine.",1,large
1984 by George Orwell,"Nothing that he does is indifferent. His friendships, his relaxations, his behaviour towards his wife and children, the expression of his face when he is alone, the words he mutters in sleep, even the characteristic movements of his body, are all jealously scrutinized. Not only any actual misdemeanour, but any eccentricity, however small, any change of habits, any nervous mannerism that could possibly be the symptom of an inner struggle, is certain to be detected. He has no freedom of choice in any direction whatever. On the other hand his actions are not regulated by law or by any clearly formulated code of behaviour. In Oceania there is no law. Thoughts and actions which, when detected, mean certain death are not formally forbidden, and the endless purges, arrests, tortures, imprisonments, and vaporizations are not inflicted as punishment for crimes which have actually been committed, but are merely the wiping-out of persons who might perhaps commit a crime at some time in the future. A Party member is required to have not only the right opinions, but the right instincts. Many of the beliefs and attitudes demanded of him are never plainly stated, and could not be stated without laying bare the contradictions inherent in Ingsoc. If he is a person naturally orthodox (in Newspeak a GOODTHINKER), he will in all circumstances know, without taking thought, what is the true belief or the desirable emotion. But in any case an elaborate mental training, undergone in childhood and grouping itself round the Newspeak words CRIMESTOP, BLACKWHITE, and DOUBLETHINK, makes him unwilling and unable to think too deeply on any subject whatever.",1,large
1984 by George Orwell,"In practice it was not difficult for any person well grounded in DOUBLETHINK to avoid doing this, but within a couple of generations even the possibility of such a lapse would have vaished. A person growing up with Newspeak as his sole language would no more know that EQUAL had once had the secondary meaning of 'politically equal', or that FREE had once meant 'intellectually free', than for instance, a person who had never heard of chess would be aware of the secondary meanings attaching to QUEEN and ROOK. There would be many crimes and errors which it would be beyond his power to commit, simply because they were nameless and therefore unimaginable. And it was to be foreseen that with the passage of time the distinguishing characteristics of Newspeak would become more and more pronounced--its words growing fewer and fewer, their meanings more and more rigid, and the chance of putting them to improper uses always diminishing. When Oldspeak had been once and for all superseded, the last link with the past would have been severed. History had already been rewritten, but fragments of the literature of the past survived here and there, imperfectly censored, and so long as one retained one's knowledge of Oldspeak it was possible to read them. In the future such fragments, even if they chanced to survive, would be unintelligible and untranslatable. It was impossible to translate any passage of Oldspeak into Newspeak unless it either referred to some technical process or some very simple everyday action, or was already orthodox (GOODTHINKFUL would be the Newspeak expression) in tendency.",1,large
1984 by George Orwell,"The old man whom he had followed was standing at the bar, having some kind of altercation with the barman, a large, stout, hook-nosed young man with enormous forearms. A knot of others, standing round with glasses in their hands, were watching the scene. 'I arst you civil enough, didn't I?' said the old man, straightening his shoulders pugnaciously. 'You telling me you ain't got a pint mug in the 'ole bleeding boozer?' 'And what in hell's name IS a pint?' said the barman, leaning forward with the tips of his fingers on the counter. ''Ark at 'im! Calls 'isself a barman and don't know what a pint is! Why, a pint's the 'alf of a quart, and there's four quarts to the gallon. 'Ave to teach you the A, B, C next.' 'Never heard of 'em,' said the barman shortly. 'Litre and half litre--that's all we serve. There's the glasses on the shelf in front of you.' 'I likes a pint,' persisted the old man. 'You could 'a drawed me off a pint easy enough. We didn't 'ave these bleeding litres when I was a young man.' 'When you were a young man we were all living in the treetops,' said the barman, with a glance at the other customers. There was a shout of laughter, and the uneasiness caused by Winston's entry seemed to disappear. The old man's whitestubbled face had flushed pink. He turned away, muttering to himself, and bumped into Winston.",1,large
1984 by George Orwell,"In the dream his deepest feeling was always one of self-deception, because he did in fact know what was behind the wall of darkness. With a deadly effort, like wrenching a piece out of his own brain, he could even have dragged the thing into the open. He always woke up without discovering what it was: but somehow it was connected with what Julia had been saying when he cut her short. 'I'm sorry,' he said, 'it's nothing. I don't like rats, that's all.' 'Don't worry, dear, we're not going to have the filthy brutes in here. I'll stuff the hole with a bit of sacking before we go. And next time we come here I'll bring some plaster and bung it up properly.' Already the black instant of panic was half-forgotten. Feeling slightly ashamed of himself, he sat up against the bedhead. Julia got out of bed, pulled on her overalls, and made the coffee. The smell that rose from the saucepan was so powerful and exciting that they shut the window lest anybody outside should notice it and become inquisitive. What was even better than the taste of the coffee was the silky texture given to it by the sugar, a thing Winston had almost forgotten after years of saccharine. With one hand in her pocket and a piece of bread and jam in the other, Julia wandered about the room, glancing indifferently at the bookcase, pointing out the best way of repairing the gateleg table, plumping herself down in the ragged arm-chair to see if it was comfortable, and examining the absurd twelve-hour clock with a sort of tolerant amusement.",1,large
1984 by George Orwell,"He was older than Winston had thought him; he was perhaps forty-eight or fifty. Under his hand there was a dial with a lever on top and figures running round the face. 'I told you,' said O'Brien, 'that if we met again it would be here.' 'Yes,' said Winston. Without any warning except a slight movement of O'Brien's hand, a wave of pain flooded his body. It was a frightening pain, because he could not see what was happening, and he had the feeling that some mortal injury was being done to him. He did not know whether the thing was really happening, or whether the effect was electrically produced; but his body was being wrenched out of shape, the joints were being slowly torn apart. Although the pain had brought the sweat out on his forehead, the worst of all was the fear that his backbone was about to snap. He set his teeth and breathed hard through his nose, trying to keep silent as long as possible. 'You are afraid,' said O'Brien, watching his face, 'that in another moment something is going to break. Your especial fear is that it will be your backbone. You have a vivid mental picture of the vertebrae snapping apart and the spinal fluid dripping out of them. That is what you are thinking, is it not, Winston?' Winston did not answer. O'Brien drew back the lever on the dial. The wave of pain receded almost as quickly as it had come.",1,large
1984 by George Orwell,"During the month of May there was only one further occasion on which they actually succeeded in making love. That was in another hidlng-place known to Julia, the belfry of a ruinous church in an almost-deserted stretch of country where an atomic bomb had fallen thirty years earlier. It was a good hiding-place when once you got there, but the getting there was very dangerous. For the rest they could meet only in the streets, in a different place every evening and never for more than half an hour at a time. In the street it was usually possible to talk, after a fashion. As they drifted down the crowded pavements, not quite abreast and never looking at one another, they carried on a curious, intermittent conversation which flicked on and off like the beams of a lighthouse, suddenly nipped into silence by the approach of a Party uniform or the proximity of a telescreen, then taken up again minutes later in the middle of a sentence, then abruptly cut short as they parted at the agreed spot, then continued almost without introduction on the following day. Julia appeared to be quite used to this kind of conversation, which she called 'talking by instalments'. She was also surprisingly adept at speaking without moving her lips. Just once in almost a month of nightly meetings they managed to exchange a kiss. They were passing in silence down a side-street (Julia would never speak when they were away from the main streets) when there was a deafening roar, the earth heaved, and the air darkened, and Winston found himself lying on his side, bruised and terrified.",1,large
1984 by George Orwell,"It was only after a decade of national wars, civil wars, revolutions, and counter-revolutions in all parts of the world that Ingsoc and its rivals emerged as fully worked-out political theories. But they had been foreshadowed by the various systems, generally called totalitarian, which had appeared earlier in the century, and the main outlines of the world which would emerge from the prevailing chaos had long been obvious. What kind of people would control this world had been equally obvious. The new aristocracy was made up for the most part of bureaucrats, scientists, technicians, trade-union organizers, publicity experts, sociologists, teachers, journalists, and professional politicians. These people, whose origins lay in the salaried middle class and the upper grades of the working class, had been shaped and brought together by the barren world of monopoly industry and centralized government. As compared with their opposite numbers in past ages, they were less avaricious, less tempted by luxury, hungrier for pure power, and, above all, more conscious of what they were doing and more intent on crushing opposition. This last difference was cardinal. By comparison with that existing today, all the tyrannies of the past were half-hearted and inefficient. The ruling groups were always infected to some extent by liberal ideas, and were content to leave loose ends everywhere, to regard only the overt act and to be uninterested in what their subjects were thinking. Even the Catholic Church of the Middle Ages was tolerant by modern standards.",1,large
1984 by George Orwell,"O'Brien!' said Winston, making an effort to control his voice. 'You know this is not necessary. What is it that you want me to do?' O'Brien made no direct answer. When he spoke it was in the schoolmasterish manner that he sometimes affected. He looked thoughtfully into the distance, as though he were addressing an audience somewhere behind Winston's back. 'By itself,' he said, 'pain is not always enough. There are occasions when a human being will stand out against pain, even to the point of death. But for everyone there is something unendurable--something that cannot be contemplated. Courage and cowardice are not involved. If you are falling from a height it is not cowardly to clutch at a rope. If you have come up from deep water it is not cowardly to fill your lungs with air. It is merely an instinct which cannot be destroyed. It is the same with the rats. For you, they are unendurable. They are a form of pressure that you cannot withstand, even if you wished to. You will do what is required of you.' 'But what is it, what is it? How can I do it if I don't know what it is?' O'Brien picked up the cage and brought it across to the nearer table. He set it down carefully on the baize cloth. Winston could hear the blood singing in his ears. He had the feeling of sitting in utter loneliness.",1,large
1984 by George Orwell,"Wine was a thing he had read and dreamed about. Like the glass paperweight or Mr Charrington's half-remembered rhymes, it belonged to the vanished, romantic past, the olden time as he liked to call it in his secret thoughts. For some reason he had always thought of wine as having an intensely sweet taste, like that of blackberry jam and an immediate intoxicating effect. Actually, when he came to swallow it, the stuff was distinctly disappointing. The truth was that after years of gin-drinking he could barely taste it. He set down the empty glass. 'Then there is such a person as Goldstein?' he said. 'Yes, there is such a person, and he is alive. Where, I do not know.' 'And the conspiracy--the organization? Is it real? It is not simply an invention of the Thought Police?' 'No, it is real. The Brotherhood, we call it. You will never learn much more about the Brotherhood than that it exists and that you belong to it. I will come back to that presently.' He looked at his wrist-watch. 'It is unwise even for members of the Inner Party to turn off the telescreen for more than half an hour. You ought not to have come here together, and you will have to leave separately. You, comrade'--he bowed his head to Julia--'will leave first. We have about twenty minutes at our disposal. You will understand that I must start by asking you certain questions.",1,large
1984 by George Orwell,"It was the type that seemed to flourish best under the dominion of the Party. The announcement from the Ministry of Plenty ended on another trumpet call and gave way to tinny music. Parsons, stirred to vague enthusiasm by the bombardment of figures, took his pipe out of his mouth. 'The Ministry of Plenty's certainly done a good job this year,' he said with a knowing shake of his head. 'By the way, Smith old boy, I suppose you haven't got any razor blades you can let me have?' 'Not one,' said Winston. 'I've been using the same blade for six weeks myself.' 'Ah, well--just thought I'd ask you, old boy.' 'Sorry,' said Winston. The quacking voice from the next table, temporarily silenced during the Ministry's announcement, had started up again, as loud as ever. For some reason Winston suddenly found himself thinking of Mrs Parsons, with her wispy hair and the dust in the creases of her face. Within two years those children would be denouncing her to the Thought Police. Mrs Parsons would be vaporized. Syme would be vaporized. Winston would be vaporized. O'Brien would be vaporized. Parsons, on the other hand, would never be vaporized. The eyeless creature with the quacking voice would never be vaporized. The little beetle-like men who scuttle so nimbly through the labyrinthine corridors of Ministries they, too, would never be vaporized. And the girl with dark hair, the girl from the Fiction Department--she would never be vaporized either.",1,large
1984 by George Orwell,"If you have come up from deep water it is not cowardly to fill your lungs with air. It is merely an instinct which cannot be destroyed. It is the same with the rats. For you, they are unendurable. They are a form of pressure that you cannot withstand, even if you wished to. You will do what is required of you.' 'But what is it, what is it? How can I do it if I don't know what it is?' O'Brien picked up the cage and brought it across to the nearer table. He set it down carefully on the baize cloth. Winston could hear the blood singing in his ears. He had the feeling of sitting in utter loneliness. He was in the middle of a great empty plain, a flat desert drenched with sunlight, across which all sounds came to him out of immense distances. Yet the cage with the rats was not two metres away from him. They were enormous rats. They were at the age when a rat's muzzle grows blunt and fierce and his fur brown instead of grey. 'The rat,' said O'Brien, still addressing his invisible audience, 'although a rodent, is carnivorous. You are aware of that. You will have heard of the things that happen in the poor quarters of this town. In some streets a woman dare not leave her baby alone in the house, even for five minutes. The rats are certain to attack it.",1,large
1984 by George Orwell,"A knot of others, standing round with glasses in their hands, were watching the scene. 'I arst you civil enough, didn't I?' said the old man, straightening his shoulders pugnaciously. 'You telling me you ain't got a pint mug in the 'ole bleeding boozer?' 'And what in hell's name IS a pint?' said the barman, leaning forward with the tips of his fingers on the counter. ''Ark at 'im! Calls 'isself a barman and don't know what a pint is! Why, a pint's the 'alf of a quart, and there's four quarts to the gallon. 'Ave to teach you the A, B, C next.' 'Never heard of 'em,' said the barman shortly. 'Litre and half litre--that's all we serve. There's the glasses on the shelf in front of you.' 'I likes a pint,' persisted the old man. 'You could 'a drawed me off a pint easy enough. We didn't 'ave these bleeding litres when I was a young man.' 'When you were a young man we were all living in the treetops,' said the barman, with a glance at the other customers. There was a shout of laughter, and the uneasiness caused by Winston's entry seemed to disappear. The old man's whitestubbled face had flushed pink. He turned away, muttering to himself, and bumped into Winston. Winston caught him gently by the arm. 'May I offer you a drink?' he said. 'You're a gent,' said the other, straightening his shoulders again.",1,large
1984 by George Orwell,"Are you guilty?' said Winston. 'Of course I'm guilty!' cried Parsons with a servile glance at the telescreen. 'You don't think the Party would arrest an innocent man, do you?' His frog-like face grew calmer, and even took on a slightly sanctimonious expression. 'Thoughtcrime is a dreadful thing, old man,' he said sententiously. 'It's insidious. It can get hold of you without your even knowing it. Do you know how it got hold of me? In my sleep! Yes, that's a fact. There I was, working away, trying to do my bit--never knew I had any bad stuff in my mind at all. And then I started talking in my sleep. Do you know what they heard me saying?' He sank his voice, like someone who is obliged for medical reasons to utter an obscenity. '""Down with Big Brother!"" Yes, I said that! Said it over and over again, it seems. Between you and me, old man, I'm glad they got me before it went any further. Do you know what I'm going to say to them when I go up before the tribunal? ""Thank you,"" I'm going to say, ""thank you for saving me before it was too late.""' 'Who denounced you?' said Winston. 'It was my little daughter,' said Parsons with a sort of doleful pride. 'She listened at the keyhole. Heard what I was saying, and nipped off to the patrols the very next day.",1,large
A Game of Thrones by George R. R. Martin,"The stars were coming out. DAENERYS The heart was steaming in the cool evening air when Khal Drogo set it before her, raw and bloody. His arms were red to the elbow. Behind him, his bloodriders knelt on the sand beside the corpse of the wild stallion, stone knives in their hands. The stallion's blood looked black in the flickering orange glare of the torches that ringed the high chalk walls of the pit. Dany touched the soft swell of her belly. Sweat beaded her skin and trickled down her brow. She could feel the old women watching her, the ancient crones of Vaes Dothrak, with eyes that shone dark as polished flint in their wrinkled faces. She must not flinch or look afraid. I am the blood of the dragon, she told herself as she took the stallion's heart in both hands, lifted it to her mouth, and plunged her teeth into the tough, stringy flesh. Warm blood filled her mouth and ran down over her chin. The taste threatened to gag her, but she made herself chew and swallow. The heart of a stallion would make her son strong and swift and fearless, or so the Dothraki believed, but only if the mother could eat it all. If she choked on the blood or retched up the flesh, the omens were less favorable; the child might be stillborn, or come forth weak, deformed, or female. Her handmaids had helped her ready herself for the ceremony.",1,large
A Game of Thrones by George R. R. Martin,"The silver horse leapt the flames as if she had wings. When she pulled up before Magister Illyrio, she said, ""Tell Khal Drogo that he has given me the wind."" The fat Pentoshi stroked his yellow beard as he repeated her words in Dothraki, and Dany saw her new husband smile for the first time. The last sliver of sun vanished behind the high walls of Pentos to the west just then. Dany had lost all track of time. Khal Drogo commanded his bloodriders to bring forth his own horse, a lean red stallion. As the khal was saddling the horse, Viserys slid close to Dany on her silver, dug his fingers into her leg, and said, ""Please him, sweet sister, or I swear, you will see the dragon wake as it has never woken before."" The fear came back to her then, with her brother's words. She felt like a child once more, only thirteen and all alone, not ready for what was about to happen to her. They rode out together as the stars came out, leaving the khalasar and the grass palaces behind. Khal Drogo spoke no word to her, but drove his stallion at a hard trot through the gathering dusk. The tiny silver bells in his long braid rang softly as he rode. ""I am the blood of the dragon,"" she whispered aloud as she followed, trying to keep her courage up. ""I am the blood of the dragon.",1,large
A Game of Thrones by George R. R. Martin,"The galley slowed. Another shout. The oars slid back inside the hull. As they thumped against the dock, Tyroshi seamen leapt down to tie up. Moreo came bustling up, all smiles. ""King's Landing, my lady, as you did command, and never has a ship made a swifter or surer passage. Will you be needing assistance to carry your things to the castle?"" ""We shall not be going to the castle. Perhaps you can suggest an inn, someplace clean and comfortable and not too far from the river."" The Tyroshi fingered his forked green beard. ""Just so. I know of several establishments that might suit your needs. Yet first, if I may be so bold, there is the matter of the second half of the payment we agreed upon. And of course the extra silver you were so kind as to promise. Sixty stags, I believe it was."" ""For the oarmen,"" Catelyn reminded him. ""Oh, of a certainty,"" said Moreo. ""Though perhaps I should hold it for them until we return to Tyrosh. For the sake of their wives and children. If you give them the silver here, my lady, they will dice it away or spend it all for a night's pleasure."" ""There are worse things to spend money on,"" Ser Rodrik put in. ""Winter is coming."" ""A man must make his own choices,"" Catelyn said. ""They earned the silver. How they spend it is no concern of mine."" ""As you say, my lady,"" Moreo replied, bowing and smiling.",1,large
A Game of Thrones by George R. R. Martin,"Illyrio whispered to them. ""Those three are Drogo's bloodriders, there,"" he said. ""By the pillar is Khal Moro, with his son Rhogoro. The man with the green beard is brother to the Archon of Tyrosh, and the man behind him is Ser Jorah Mormont."" The last name caught Daenerys. ""A knight?"" ""No less."" Illyrio smiled through his beard. ""Anointed with the seven oils by the High Septon himself."" ""What is he doing here?"" she blurted. ""The Usurper wanted his head,"" Illyrio told them. ""Some trifling affront. He sold some poachers to a Tyroshi slaver instead of giving them to the Night's Watch. Absurd law. A man should be able to do as he likes with his own chattel."" ""I shall wish to speak with Ser Jorah before the night is done,"" her brother said. Dany found herself looking at the knight curiously. He was an older man, past forty and balding, but still strong and fit. Instead of silks and cottons, he wore wool and leather. His tunic was a dark green, embroidered with the likeness of a black bear standing on two legs. She was still looking at this strange man from the homeland she had never known when Magister Illyrio placed a moist hand on her bare shoulder. ""Over there, sweet princess,"" he whispered, ""there is the khal himself."" Dany wanted to run and hide, but her brother was looking at her, and if she displeased him she knew she would wake the dragon.",1,large
